{
  "schema_version": 1,
  "work_id": "gef-intro",
  "language_code": "he-Latn",
  "lexemes": [
    {
      "lexeme_id": "b051d0c0-8e39-434f-b3a0-9f86179e0cec",
      "lemma_nfc": "Gef",
      "upos": "PROPN",
      "proper_noun": true,
      "review_state": "candidate",
      "senses": [
        {
          "sense_id": "73284760-0074-4c41-a837-721d44efa9cf",
          "sense_key": "gef-propn-sense1",
          "primary_concept_id": null,
          "definitions": {
            "en": "definition of 'Gef' in context as a propn",
            "es": "definición de 'Gef' en contexto como propn",
            "fr": "définition de 'Gef' en contexte comme propn",
            "pt": "definição de 'Gef' em contexto como propn",
            "it": "definizione di 'Gef' in contesto come propn",
            "el": "ορισμός του 'Gef' στο πλαίσιο ως propn"
          },
          "sense_hint": {
            "en": "as used in story context ('Gef')",
            "es": "como se usa en el contexto ('Gef')"
          },
          "cefr_level": "A1",
          "register_label": "literary",
          "homophones": [],
          "homonyms": [],
          "synonyms": [
            "Gef_syn1"
          ],
          "antonyms": [],
          "confusable_senses": [
            "Gef_distractor_a",
            "Gef_distractor_b"
          ]
        }
      ],
      "forms": [
        {
          "form_id": "54fcfb38-80a5-4866-9fa1-dd16e6ad8f78",
          "surface_nfc": "Gef",
          "normalized_lookup": "gef",
          "attested_in_text": true,
          "analyses": [
            {
              "analysis_id": "a50fcd01-5105-43d4-849c-c106c785156c",
              "features": {
                "base": {
                  "number": "singular",
                  "gender": "common"
                },
                "possessor": {},
                "subject": {},
                "object": {},
                "clitic": {}
              },
              "display_label_key": "propn form"
            }
          ]
        }
      ],
      "language_pos": "proper-name"
    },
    {
      "lexeme_id": "b28b2472-c84d-4740-8718-7d62ccc96488",
      "lemma_nfc": "Jeff",
      "upos": "PROPN",
      "proper_noun": true,
      "review_state": "candidate",
      "senses": [
        {
          "sense_id": "bea13aba-07aa-47b9-bc36-1b8842ea050b",
          "sense_key": "jeff-propn-sense1",
          "primary_concept_id": null,
          "definitions": {
            "en": "definition of 'Jeff' in context as a propn",
            "es": "definición de 'Jeff' en contexto como propn",
            "fr": "définition de 'Jeff' en contexte comme propn",
            "pt": "definição de 'Jeff' em contexto como propn",
            "it": "definizione di 'Jeff' in contesto come propn",
            "el": "ορισμός του 'Jeff' στο πλαίσιο ως propn"
          },
          "sense_hint": {
            "en": "as used in story context ('Jeff')",
            "es": "como se usa en el contexto ('Jeff')"
          },
          "cefr_level": "A1",
          "register_label": "literary",
          "homophones": [
            "Jeff_hp1"
          ],
          "homonyms": [],
          "synonyms": [
            "Jeff_syn1"
          ],
          "antonyms": [],
          "confusable_senses": [
            "Jeff_distractor_a",
            "Jeff_distractor_b"
          ]
        }
      ],
      "forms": [
        {
          "form_id": "16859c0c-e7df-4dc4-a811-394fc9f8ceee",
          "surface_nfc": "Jeff",
          "normalized_lookup": "jeff",
          "attested_in_text": true,
          "analyses": [
            {
              "analysis_id": "541b7b81-34d5-4a28-8129-f5ca900ca7a6",
              "features": {
                "base": {
                  "number": "singular",
                  "gender": "common"
                },
                "possessor": {},
                "subject": {},
                "object": {},
                "clitic": {}
              },
              "display_label_key": "propn form"
            }
          ]
        }
      ],
      "language_pos": "proper-name"
    }
  ]
}
