{
  "schema_version": 1,
  "work_id": "gef-intro",
  "language_code": "ka-Latn",
  "lexemes": [
    {
      "lexeme_id": "5a04f270-0027-447f-b64e-4006a3710b14",
      "lemma_nfc": "Trials",
      "upos": "PROPN",
      "proper_noun": true,
      "review_state": "candidate",
      "senses": [
        {
          "sense_id": "4bc82038-9e8e-4369-823a-98c9c5939776",
          "sense_key": "trials-propn-sense1",
          "primary_concept_id": null,
          "definitions": {
            "en": "definition of 'Trials' in context as a propn",
            "es": "definición de 'Trials' en contexto como propn",
            "fr": "définition de 'Trials' en contexte comme propn",
            "pt": "definição de 'Trials' em contexto como propn",
            "it": "definizione di 'Trials' in contesto come propn",
            "el": "ορισμός του 'Trials' στο πλαίσιο ως propn"
          },
          "sense_hint": {
            "en": "as used in story context ('Trials')",
            "es": "como se usa en el contexto ('Trials')"
          },
          "cefr_level": "A2",
          "register_label": "literary",
          "homophones": [
            "Trials_hp1"
          ],
          "homonyms": [
            "Trials_hm1"
          ],
          "synonyms": [
            "Trials_syn1"
          ],
          "antonyms": [],
          "confusable_senses": [
            "Trials_distractor_a",
            "Trials_distractor_b"
          ]
        }
      ],
      "forms": [
        {
          "form_id": "19aabb9e-e555-4696-bc41-f39473d1c7fa",
          "surface_nfc": "Trials",
          "normalized_lookup": "trials",
          "attested_in_text": true,
          "analyses": [
            {
              "analysis_id": "8bd4ff1c-094b-48d2-8984-7a904fe10074",
              "features": {
                "base": {
                  "number": "singular",
                  "gender": "common"
                },
                "possessor": {},
                "subject": {},
                "object": {},
                "clitic": {}
              },
              "display_label_key": "propn form"
            }
          ]
        }
      ],
      "language_pos": "proper-name"
    }
  ]
}
