{
  "schema_version": 1,
  "work_id": "gef-intro",
  "language_code": "pa",
  "lexemes": [
    {
      "lexeme_id": "1f8025bd-0afd-4eb1-8da7-237de28f4d23",
      "lemma_nfc": "Gef",
      "upos": "PROPN",
      "proper_noun": true,
      "review_state": "candidate",
      "senses": [
        {
          "sense_id": "b72ff0a1-57b6-4e2d-a4f1-ebb27f40fb3a",
          "sense_key": "gef-propn-sense1",
          "primary_concept_id": null,
          "definitions": {
            "en": "definition of 'Gef' in context as a propn",
            "es": "definición de 'Gef' en contexto como propn",
            "fr": "définition de 'Gef' en contexte comme propn",
            "pt": "definição de 'Gef' em contexto como propn",
            "it": "definizione di 'Gef' in contesto come propn",
            "el": "ορισμός του 'Gef' στο πλαίσιο ως propn"
          },
          "sense_hint": {
            "en": "as used in story context ('Gef')",
            "es": "como se usa en el contexto ('Gef')"
          },
          "cefr_level": "A1",
          "register_label": "literary",
          "homophones": [],
          "homonyms": [],
          "synonyms": [
            "Gef_syn1"
          ],
          "antonyms": [],
          "confusable_senses": [
            "Gef_distractor_a",
            "Gef_distractor_b"
          ]
        }
      ],
      "forms": [
        {
          "form_id": "1a06072d-3152-4f48-bf68-7299043ffa2e",
          "surface_nfc": "Gef",
          "normalized_lookup": "gef",
          "attested_in_text": true,
          "analyses": [
            {
              "analysis_id": "c2052de3-6e0d-4ac9-a2a5-ae4ef323c864",
              "features": {
                "base": {
                  "number": "singular",
                  "gender": "common"
                },
                "possessor": {},
                "subject": {},
                "object": {},
                "clitic": {}
              },
              "display_label_key": "propn form"
            }
          ]
        }
      ],
      "language_pos": "proper-name"
    },
    {
      "lexeme_id": "bff8ce86-f197-4598-90ab-62b054b5991c",
      "lemma_nfc": "Jeff",
      "upos": "PROPN",
      "proper_noun": true,
      "review_state": "candidate",
      "senses": [
        {
          "sense_id": "00a50be6-9128-49cc-9560-9f52bfd96875",
          "sense_key": "jeff-propn-sense1",
          "primary_concept_id": null,
          "definitions": {
            "en": "definition of 'Jeff' in context as a propn",
            "es": "definición de 'Jeff' en contexto como propn",
            "fr": "définition de 'Jeff' en contexte comme propn",
            "pt": "definição de 'Jeff' em contexto como propn",
            "it": "definizione di 'Jeff' in contesto come propn",
            "el": "ορισμός του 'Jeff' στο πλαίσιο ως propn"
          },
          "sense_hint": {
            "en": "as used in story context ('Jeff')",
            "es": "como se usa en el contexto ('Jeff')"
          },
          "cefr_level": "A1",
          "register_label": "literary",
          "homophones": [
            "Jeff_hp1"
          ],
          "homonyms": [],
          "synonyms": [
            "Jeff_syn1"
          ],
          "antonyms": [],
          "confusable_senses": [
            "Jeff_distractor_a",
            "Jeff_distractor_b"
          ]
        }
      ],
      "forms": [
        {
          "form_id": "6cf0dcd3-8b89-4b48-a78f-b68fd987b11c",
          "surface_nfc": "Jeff",
          "normalized_lookup": "jeff",
          "attested_in_text": true,
          "analyses": [
            {
              "analysis_id": "d378b2dc-19e8-4390-abf9-978d224d51bd",
              "features": {
                "base": {
                  "number": "singular",
                  "gender": "common"
                },
                "possessor": {},
                "subject": {},
                "object": {},
                "clitic": {}
              },
              "display_label_key": "propn form"
            }
          ]
        }
      ],
      "language_pos": "proper-name"
    }
  ]
}
