{
  "schema_version": 1,
  "work_id": "gef-intro",
  "language_code": "sd",
  "lexemes": [
    {
      "lexeme_id": "277164d2-e708-47f9-8183-152b9eac409f",
      "lemma_nfc": "Gef",
      "upos": "PROPN",
      "proper_noun": true,
      "review_state": "candidate",
      "senses": [
        {
          "sense_id": "ff668acd-45fd-40b6-b4a6-7744e448f0da",
          "sense_key": "gef-propn-sense1",
          "primary_concept_id": null,
          "definitions": {
            "en": "definition of 'Gef' in context as a propn",
            "es": "definición de 'Gef' en contexto como propn",
            "fr": "définition de 'Gef' en contexte comme propn",
            "pt": "definição de 'Gef' em contexto como propn",
            "it": "definizione di 'Gef' in contesto come propn",
            "el": "ορισμός του 'Gef' στο πλαίσιο ως propn"
          },
          "sense_hint": {
            "en": "as used in story context ('Gef')",
            "es": "como se usa en el contexto ('Gef')"
          },
          "cefr_level": "A1",
          "register_label": "literary",
          "homophones": [],
          "homonyms": [],
          "synonyms": [
            "Gef_syn1"
          ],
          "antonyms": [],
          "confusable_senses": [
            "Gef_distractor_a",
            "Gef_distractor_b"
          ]
        }
      ],
      "forms": [
        {
          "form_id": "cc88d14c-bd4e-4d37-80c1-7eabc7063fb8",
          "surface_nfc": "Gef",
          "normalized_lookup": "gef",
          "attested_in_text": true,
          "analyses": [
            {
              "analysis_id": "73a7c982-0d4d-4b9f-a8e8-153e5089b760",
              "features": {
                "base": {
                  "number": "singular",
                  "gender": "common"
                },
                "possessor": {},
                "subject": {},
                "object": {},
                "clitic": {}
              },
              "display_label_key": "propn form"
            }
          ]
        }
      ],
      "language_pos": "proper-name"
    },
    {
      "lexeme_id": "5df31eeb-524f-416d-b736-932e717ee6ec",
      "lemma_nfc": "Jeff",
      "upos": "PROPN",
      "proper_noun": true,
      "review_state": "candidate",
      "senses": [
        {
          "sense_id": "3c4e6780-8102-4fb6-9e87-bb099e53b97d",
          "sense_key": "jeff-propn-sense1",
          "primary_concept_id": null,
          "definitions": {
            "en": "definition of 'Jeff' in context as a propn",
            "es": "definición de 'Jeff' en contexto como propn",
            "fr": "définition de 'Jeff' en contexte comme propn",
            "pt": "definição de 'Jeff' em contexto como propn",
            "it": "definizione di 'Jeff' in contesto come propn",
            "el": "ορισμός του 'Jeff' στο πλαίσιο ως propn"
          },
          "sense_hint": {
            "en": "as used in story context ('Jeff')",
            "es": "como se usa en el contexto ('Jeff')"
          },
          "cefr_level": "A1",
          "register_label": "literary",
          "homophones": [
            "Jeff_hp1"
          ],
          "homonyms": [],
          "synonyms": [
            "Jeff_syn1"
          ],
          "antonyms": [],
          "confusable_senses": [
            "Jeff_distractor_a",
            "Jeff_distractor_b"
          ]
        }
      ],
      "forms": [
        {
          "form_id": "8b4b420f-146c-4e73-a4ef-0a00d30b53cc",
          "surface_nfc": "Jeff",
          "normalized_lookup": "jeff",
          "attested_in_text": true,
          "analyses": [
            {
              "analysis_id": "648a4157-4e00-4ba9-a24b-005b5770ccd8",
              "features": {
                "base": {
                  "number": "singular",
                  "gender": "common"
                },
                "possessor": {},
                "subject": {},
                "object": {},
                "clitic": {}
              },
              "display_label_key": "propn form"
            }
          ]
        }
      ],
      "language_pos": "proper-name"
    }
  ]
}
