{
  "schema_version": 1,
  "work_id": "gef-intro",
  "language_code": "ka",
  "lexemes": [
    {
      "lexeme_id": "2516e468-aeb2-4d7f-9e5f-9c353c5e3eb3",
      "lemma_nfc": "Gef",
      "upos": "PROPN",
      "proper_noun": true,
      "review_state": "candidate",
      "senses": [
        {
          "sense_id": "6a11847d-dc0f-4dad-8f15-6b7974ebc260",
          "sense_key": "gef-propn-sense1",
          "primary_concept_id": null,
          "definitions": {
            "en": "definition of 'Gef' in context as a propn",
            "es": "definición de 'Gef' en contexto como propn",
            "fr": "définition de 'Gef' en contexte comme propn",
            "pt": "definição de 'Gef' em contexto como propn",
            "it": "definizione di 'Gef' in contesto come propn",
            "el": "ορισμός του 'Gef' στο πλαίσιο ως propn"
          },
          "sense_hint": {
            "en": "as used in story context ('Gef')",
            "es": "como se usa en el contexto ('Gef')"
          },
          "cefr_level": "A1",
          "register_label": "literary",
          "homophones": [],
          "homonyms": [],
          "synonyms": [
            "Gef_syn1"
          ],
          "antonyms": [],
          "confusable_senses": [
            "Gef_distractor_a",
            "Gef_distractor_b"
          ]
        }
      ],
      "forms": [
        {
          "form_id": "0a60619a-63e3-4535-af69-d59dc5df8c6b",
          "surface_nfc": "Gef",
          "normalized_lookup": "gef",
          "attested_in_text": true,
          "analyses": [
            {
              "analysis_id": "0f816085-ad4b-4441-934b-6d2c72e4e8c4",
              "features": {
                "base": {
                  "number": "singular",
                  "gender": "common"
                },
                "possessor": {},
                "subject": {},
                "object": {},
                "clitic": {}
              },
              "display_label_key": "propn form"
            }
          ]
        }
      ],
      "language_pos": "proper-name"
    },
    {
      "lexeme_id": "16218f1d-7de4-4023-8af7-4033ef99d8d1",
      "lemma_nfc": "Jeff",
      "upos": "PROPN",
      "proper_noun": true,
      "review_state": "candidate",
      "senses": [
        {
          "sense_id": "0eb6c377-5e1d-442d-b7ed-f8f0f26092ee",
          "sense_key": "jeff-propn-sense1",
          "primary_concept_id": null,
          "definitions": {
            "en": "definition of 'Jeff' in context as a propn",
            "es": "definición de 'Jeff' en contexto como propn",
            "fr": "définition de 'Jeff' en contexte comme propn",
            "pt": "definição de 'Jeff' em contexto como propn",
            "it": "definizione di 'Jeff' in contesto come propn",
            "el": "ορισμός του 'Jeff' στο πλαίσιο ως propn"
          },
          "sense_hint": {
            "en": "as used in story context ('Jeff')",
            "es": "como se usa en el contexto ('Jeff')"
          },
          "cefr_level": "A1",
          "register_label": "literary",
          "homophones": [
            "Jeff_hp1"
          ],
          "homonyms": [],
          "synonyms": [
            "Jeff_syn1"
          ],
          "antonyms": [],
          "confusable_senses": [
            "Jeff_distractor_a",
            "Jeff_distractor_b"
          ]
        }
      ],
      "forms": [
        {
          "form_id": "4d7482a2-3127-4aaa-ab97-d3cca33bc188",
          "surface_nfc": "Jeff",
          "normalized_lookup": "jeff",
          "attested_in_text": true,
          "analyses": [
            {
              "analysis_id": "13ce0fc6-7d54-4843-8646-fc2299aa7b33",
              "features": {
                "base": {
                  "number": "singular",
                  "gender": "common"
                },
                "possessor": {},
                "subject": {},
                "object": {},
                "clitic": {}
              },
              "display_label_key": "propn form"
            }
          ]
        }
      ],
      "language_pos": "proper-name"
    }
  ]
}
